{"schema_version":1,"run_id":"run-cli","node_id":"validate-cli","gate_id":"validate-cli","work_item_id":"TEST-1","phase":"VALIDATE","trigger":"fixture","task":"validate CLI","actor_capability":"executor","success_condition":"tests exit zero","verifier_ids":["test"],"input_artifacts":["src/**"],"output_artifacts":["src/greet.py"],"allowed_paths":["src/**","tests/**","node.json","project.adapter.json"],"frozen_paths":["requirements/**"],"retry_cap":3,"escalation_target":"human"}
