{"schema_version":1,"run_id":"run-docs","node_id":"validate-docs","gate_id":"validate-docs","work_item_id":"TEST-2","phase":"VALIDATE","trigger":"fixture","task":"validate docs","actor_capability":"executor","success_condition":"documentation checks exit zero","verifier_ids":["docs-check"],"input_artifacts":["docs/**"],"output_artifacts":["docs/guide.md"],"allowed_paths":["docs/**","tests/**","node.json","project.adapter.json"],"frozen_paths":["requirements/**"],"retry_cap":3,"escalation_target":"human"}
